<!--
  * dtd/pluginSettings.dtd
  *
  * Copyright (c) 2014-2021 Simon Fraser University
  * Copyright (c) 2000-2021 John Willinsky
  * Distributed under the GNU GPL v3. For full terms see the file docs/COPYING.
  *
  * DTD for installing plugin settings.
  *
  -->

<!ELEMENT plugin_settings (setting+)>
<!ELEMENT setting (name, value)>
<!ATTLIST setting type (int|string|object|bool) #REQUIRED>
<!ELEMENT name (#PCDATA)>
<!ELEMENT value (#PCDATA | array)*>
<!ELEMENT element (#PCDATA | array)*>
<!ATTLIST element key CDATA #IMPLIED>
<!ELEMENT array (element+)>

